{
  "$schema": "https://json-schema.org/draft/2020-12/schema",
  "$id": "urn:noss:schema:track:1",
  "title": "nOSS track",
  "description": "track.json inside a .nosstrack (or a built-in track folder): road, race setup, ground, props and environment. See docs/TRACK_EDITOR.md §5.",
  "type": "object",
  "additionalProperties": false,
  "required": ["schema", "id", "name", "type", "road", "race"],
  "properties": {
    "schema": { "const": "noss.track/1" },
    "id": { "type": "string", "minLength": 1, "maxLength": 64 },
    "name": { "type": "string", "minLength": 1, "maxLength": 64 },
    "author": { "type": "string", "maxLength": 64 },
    "license": { "type": "string", "maxLength": 64 },
    "type": { "enum": ["circuit", "highway", "arena"] },
    "style": { "type": "string", "pattern": "^[a-z0-9_]+$", "maxLength": 32 },
    "road": {
      "type": "object",
      "additionalProperties": false,
      "required": ["points"],
      "properties": {
        "mode": {
          "description": "road: the road is built from the spline. centreline: a scene track's road is the scene; the spline only times and guides.",
          "enum": ["road", "centreline"]
        },
        "defaults": { "$ref": "#/$defs/attributes" },
        "points": {
          "type": "array",
          "maxItems": 2000,
          "items": {
            "allOf": [
              { "$ref": "#/$defs/attributes" },
              { "type": "object", "required": ["p"] }
            ]
          }
        }
      }
    },
    "race": {
      "type": "object",
      "additionalProperties": false,
      "properties": {
        "start_m": { "$ref": "#/$defs/distance" },
        "sectors_m": { "type": "array", "maxItems": 16, "items": { "$ref": "#/$defs/distance" } },
        "checkpoint_spacing_m": { "type": "number", "minimum": 20, "maximum": 1000 },
        "grid": {
          "type": "object",
          "additionalProperties": false,
          "properties": {
            "slots": { "type": "integer", "minimum": 1, "maximum": 32 },
            "front_m": { "type": "number", "minimum": 2, "maximum": 100 },
            "row_m": { "type": "number", "minimum": 5, "maximum": 40 },
            "stagger": { "type": "number", "minimum": 0, "maximum": 1 },
            "pole": { "enum": ["left", "right"] }
          }
        },
        "rolling_back_m": { "type": "number", "minimum": 0, "maximum": 2000 },
        "gantry": { "type": "boolean" },
        "ai": {
          "type": "object",
          "additionalProperties": false,
          "properties": {
            "caution_until_m": { "type": "number", "minimum": -1, "maximum": 200000 },
            "pins": {
              "type": "array",
              "maxItems": 500,
              "items": {
                "type": "object",
                "additionalProperties": false,
                "required": ["at_m", "offset_m"],
                "properties": {
                  "at_m": { "$ref": "#/$defs/distance" },
                  "offset_m": { "type": "number", "minimum": -50, "maximum": 50 }
                }
              }
            }
          }
        }
      }
    },
    "rules": {
      "description": "Track-mode rules the track suggests (D207): events that keep \"Track's\" race with them. Not part of the layout.",
      "type": "object",
      "additionalProperties": false,
      "properties": {
        "start": { "enum": ["standing", "rolling"] },
        "draft": { "type": "boolean" },
        "fuel_x": { "type": "integer", "minimum": 0, "maximum": 10 },
        "tyre_x": { "type": "integer", "minimum": 0, "maximum": 10 },
        "pack": { "description": "Pack racing for the AI, with drafting on.", "type": "boolean" }
      }
    },
    "pit": {
      "description": "A circuit's pit lane (docs/TRACK_EDITOR.md §4, D203): it leaves the road on one side at from_m and has joined it again by to_m (metres along the road from point 0), attached for taper_m at each end and through its own points between.",
      "type": "object",
      "additionalProperties": false,
      "required": ["from_m", "to_m"],
      "properties": {
        "side": { "enum": ["left", "right"] },
        "from_m": { "$ref": "#/$defs/distance" },
        "to_m": { "$ref": "#/$defs/distance" },
        "taper_m": { "type": "number", "minimum": 20, "maximum": 400 },
        "points": {
          "type": "array",
          "maxItems": 200,
          "items": {
            "type": "object",
            "additionalProperties": false,
            "required": ["p"],
            "properties": { "p": { "$ref": "#/$defs/vec3" }, "height": { "enum": ["ground", "set"] } }
          }
        },
        "width_m": { "type": "number", "minimum": 4, "maximum": 30 },
        "speed_kmh": { "type": "number", "minimum": 20, "maximum": 200 },
        "limit_m": { "type": "number", "minimum": 0, "maximum": 500 },
        "boxes": { "type": "integer", "minimum": 1, "maximum": 40 },
        "box_m": { "type": "number", "minimum": 5, "maximum": 30 },
        "wall": { "type": "boolean" }
      }
    },
    "roads": {
      "description": "Scenery roads (docs/TRACK_EDITOR.md §4, D212): open roads round the course that aren't part of it, the rest of a venue. Each is made as the road is, from its own points and defaults; where it runs onto the road or its pit lane its edge stops at theirs, and where it's wholly on them it's cut. Cars can drive them; nothing is timed there.",
      "type": "array",
      "maxItems": 32,
      "items": {
        "type": "object",
        "additionalProperties": false,
        "required": ["points"],
        "properties": {
          "name": { "type": "string", "maxLength": 64 },
          "defaults": { "$ref": "#/$defs/attributes" },
          "points": {
            "type": "array",
            "minItems": 2,
            "maxItems": 2000,
            "items": {
              "allOf": [
                { "$ref": "#/$defs/attributes" },
                { "type": "object", "required": ["p"] }
              ]
            }
          }
        }
      }
    },
    "highway": {
      "description": "A highway's carriageways, ramps, portals, runs and traffic (type highway; docs/TRACK_EDITOR.md §1, D106). The road is the median's centreline; direction 1 drives along it on its right, -1 the other way.",
      "type": "object",
      "additionalProperties": false,
      "properties": {
        "drive": { "enum": ["right"] },
        "lanes": { "type": "integer", "minimum": 1, "maximum": 5 },
        "lane_m": { "type": "number", "minimum": 2.5, "maximum": 5 },
        "median_m": { "type": "number", "minimum": 0.5, "maximum": 40 },
        "shoulder_in_m": { "type": "number", "minimum": 0, "maximum": 5 },
        "shoulder_out_m": { "type": "number", "minimum": 0, "maximum": 6 },
        "median_barrier": { "enum": ["none", "concrete", "armco", "fence"] },
        "speed_kmh": { "$ref": "#/$defs/speed" },
        "zones": {
          "type": "array",
          "maxItems": 64,
          "items": {
            "type": "object",
            "additionalProperties": false,
            "required": ["from_m", "to_m"],
            "properties": {
              "dir": { "enum": [-1, 0, 1] },
              "from_m": { "$ref": "#/$defs/distance" },
              "to_m": { "$ref": "#/$defs/distance" },
              "speed_kmh": { "$ref": "#/$defs/speed" },
              "tunnel": { "type": "boolean" },
              "name": { "$ref": "#/$defs/label" }
            }
          }
        },
        "ramps": {
          "type": "array",
          "maxItems": 64,
          "items": {
            "type": "object",
            "additionalProperties": false,
            "required": ["id", "kind", "from", "to"],
            "properties": {
              "id": { "$ref": "#/$defs/id" },
              "name": { "$ref": "#/$defs/label" },
              "kind": { "enum": ["exit", "entry", "link"] },
              "from": { "$ref": "#/$defs/ramp_end" },
              "to": { "$ref": "#/$defs/ramp_end" },
              "lanes": { "type": "integer", "minimum": 1, "maximum": 2 },
              "lane_m": { "type": "number", "minimum": 2.5, "maximum": 5 },
              "taper_m": { "type": "number", "minimum": 40, "maximum": 600 },
              "speed_kmh": { "$ref": "#/$defs/speed" },
              "traffic": { "type": "boolean" },
              "points": {
                "type": "array",
                "maxItems": 200,
                "items": {
                  "type": "object",
                  "additionalProperties": false,
                  "required": ["p"],
                  "properties": {
                    "p": { "$ref": "#/$defs/vec3" },
                    "height": { "enum": ["ground", "set"] }
                  }
                }
              }
            }
          }
        },
        "portals": {
          "type": "array",
          "maxItems": 32,
          "items": {
            "type": "object",
            "additionalProperties": false,
            "required": ["id", "p"],
            "properties": {
              "id": { "$ref": "#/$defs/id" },
              "name": { "$ref": "#/$defs/label" },
              "p": { "$ref": "#/$defs/vec3" },
              "yaw_deg": { "type": "number", "minimum": -360, "maximum": 360 }
            }
          }
        },
        "runs": {
          "type": "array",
          "maxItems": 32,
          "items": {
            "type": "object",
            "additionalProperties": false,
            "required": ["id", "dir", "from_m", "to_m"],
            "properties": {
              "id": { "$ref": "#/$defs/id" },
              "name": { "$ref": "#/$defs/label" },
              "dir": { "enum": [-1, 1] },
              "from_m": { "$ref": "#/$defs/distance" },
              "to_m": { "$ref": "#/$defs/distance" }
            }
          }
        },
        "traps": {
          "type": "array",
          "maxItems": 32,
          "items": {
            "type": "object",
            "additionalProperties": false,
            "required": ["dir", "at_m"],
            "properties": {
              "dir": { "enum": [-1, 1] },
              "at_m": { "$ref": "#/$defs/distance" }
            }
          }
        },
        "traffic": {
          "type": "object",
          "additionalProperties": false,
          "properties": {
            "count": { "type": "integer", "minimum": 0, "maximum": 1000 },
            "exit_share": { "type": "number", "minimum": 0, "maximum": 1 },
            "seed": { "type": "integer", "minimum": 0, "maximum": 2147483647 }
          }
        }
      }
    },
    "kart": {
      "description": "Kart pieces (D136, D137): stunts along the road (at_m) or, in an arena, anywhere (p, yaw_deg); item boxes automatic, placed or none.",
      "type": "object",
      "additionalProperties": false,
      "properties": {
        "boxes": { "enum": ["auto", "placed", "none"] },
        "stunts": { "type": "array", "maxItems": 64, "items": { "$ref": "#/$defs/stunt" } }
      }
    },
    "arena": {
      "description": "An arena's floor, wall, spawns and item box clusters (D138); empty lists are filled automatically.",
      "type": "object",
      "additionalProperties": false,
      "properties": {
        "floor": { "$ref": "#/$defs/surface" },
        "wall": { "$ref": "#/$defs/barrier" },
        "wall_m": { "type": "number", "minimum": 0.3, "maximum": 6 },
        "spawns": {
          "type": "array", "maxItems": 32,
          "items": { "type": "object", "additionalProperties": false, "required": ["p"],
            "properties": { "p": { "$ref": "#/$defs/vec3" }, "yaw_deg": { "type": "number", "minimum": -360, "maximum": 360 } } }
        },
        "boxes": {
          "type": "array", "maxItems": 16,
          "items": { "type": "object", "additionalProperties": false, "required": ["p"],
            "properties": { "p": { "$ref": "#/$defs/vec3" }, "count": { "type": "integer", "minimum": 1, "maximum": 8 } } }
        }
      }
    },
    "ground": {
      "type": "object",
      "additionalProperties": false,
      "properties": {
        "terrain": { "type": "string", "const": "terrain/meta.json" },
        "flat_y": { "type": "number", "minimum": -1000, "maximum": 1000 },
        "surface": { "$ref": "#/$defs/surface" }
      }
    },
    "props": {
      "type": "object",
      "additionalProperties": false,
      "properties": {
        "items": {
          "type": "array",
          "maxItems": 5000,
          "items": {
            "type": "object",
            "additionalProperties": false,
            "required": ["prop", "p"],
            "properties": {
              "prop": { "$ref": "#/$defs/id" },
              "p": { "$ref": "#/$defs/vec3" },
              "yaw_deg": { "type": "number", "minimum": -360, "maximum": 360 },
              "scale": { "type": "number", "minimum": 0.1, "maximum": 10 },
              "size": { "$ref": "#/$defs/vec3" },
              "ground": { "type": "boolean" }
            }
          }
        },
        "scatter": {
          "type": "array",
          "maxItems": 64,
          "items": {
            "type": "object",
            "additionalProperties": false,
            "required": ["prop", "xf"],
            "properties": {
              "prop": { "$ref": "#/$defs/id" },
              "xf": {
                "description": "x, z, yaw (radians), scale per instance; y comes from the ground.",
                "type": "array",
                "maxItems": 800000
              }
            }
          }
        }
      }
    },
    "environment": {
      "type": "object",
      "additionalProperties": false,
      "properties": {
        "sun_elevation_deg": { "type": "number", "minimum": -10, "maximum": 90 },
        "sun_azimuth_deg": { "type": "number", "minimum": -360, "maximum": 360 },
        "fog": { "enum": ["light", "normal", "heavy"] },
        "floodlit": { "description": "Light towers: after dark the track is lit (D205).", "type": "boolean" },
        "time": { "description": "The track's own time of day (absent: its fixed sun). M9.", "enum": ["dawn", "morning", "noon", "afternoon", "dusk", "night"] },
        "weather": { "description": "The track's own weather (absent: clear). M9.", "enum": ["clear", "cloudy", "rain", "storm", "fog", "snow", "changing"] },
        "biome": { "description": "A setting: an endless biome's sky and sounds throughout (D221; a graveyard circuit: haunted).", "enum": ["coast", "forest", "farmland", "canyon", "alpine", "snow", "autumn", "haunted"] }
      }
    },
    "scene": {
      "oneOf": [
        { "type": "null" },
        {
          "type": "object",
          "additionalProperties": false,
          "required": ["glb", "tags"],
          "properties": {
            "glb": { "const": "scene/scene.glb" },
            "tags": { "const": "scene/tags.json" }
          }
        }
      ]
    }
  },
  "$defs": {
    "stunt": {
      "type": "object",
      "additionalProperties": false,
      "required": ["id", "kind"],
      "properties": {
        "id": { "$ref": "#/$defs/id" },
        "kind": { "enum": ["boost_pad", "item_row", "jump", "wall_ride", "loop"] },
        "at_m": { "$ref": "#/$defs/distance" },
        "lateral_m": { "type": "number", "minimum": -40, "maximum": 40 },
        "p": { "$ref": "#/$defs/vec3" },
        "yaw_deg": { "type": "number", "minimum": -360, "maximum": 360 },
        "length_m": { "type": "number", "minimum": 1, "maximum": 400 },
        "width_m": { "type": "number", "minimum": 0, "maximum": 40 },
        "height_m": { "type": "number", "minimum": 0.2, "maximum": 12 },
        "count": { "type": "integer", "minimum": 0, "maximum": 8 },
        "side": { "enum": ["left", "right"] },
        "radius_m": { "type": "number", "minimum": 7, "maximum": 14 }
      }
    },
    "label": { "type": "string", "maxLength": 48 },
    "speed": { "type": "number", "minimum": 20, "maximum": 300 },
    "barrier": { "enum": ["none", "auto", "tyres", "armco", "concrete", "fence", "sound_wall", "safer"] },
    "ramp_end": {
      "description": "Where a ramp meets the road: a carriageway (dir) at a distance along the road (from: where it starts to leave; to: where it has merged), or a portal.",
      "type": "object",
      "additionalProperties": false,
      "properties": {
        "dir": { "enum": [-1, 1] },
        "at_m": { "$ref": "#/$defs/distance" },
        "portal": { "$ref": "#/$defs/id" }
      }
    },
    "id": { "type": "string", "pattern": "^[a-z0-9_]+$", "maxLength": 32 },
    "distance": { "type": "number", "minimum": 0, "maximum": 200000 },
    "coord": { "type": "number", "minimum": -100000, "maximum": 100000 },
    "vec3": {
      "type": "array",
      "prefixItems": [{ "$ref": "#/$defs/coord" }, { "$ref": "#/$defs/coord" }, { "$ref": "#/$defs/coord" }],
      "minItems": 3,
      "maxItems": 3
    },
    "surface": { "enum": ["asphalt", "concrete", "curb", "paint", "grass", "gravel", "dirt", "sand", "snow", "ice"] },
    "attributes": {
      "type": "object",
      "additionalProperties": false,
      "properties": {
        "p": { "$ref": "#/$defs/vec3" },
        "width_l": { "type": "number", "minimum": 1, "maximum": 40 },
        "width_r": { "type": "number", "minimum": 1, "maximum": 40 },
        "bank_deg": { "type": "number", "minimum": -45, "maximum": 45 },
        "height": { "enum": ["ground", "set"] },
        "lanes": { "type": "integer", "minimum": 1, "maximum": 8 },
        "lines": { "enum": ["none", "edges", "lanes", "all"] },
        "surface": { "$ref": "#/$defs/surface" },
        "curb_l": { "enum": ["auto", "on", "off"] },
        "curb_r": { "enum": ["auto", "on", "off"] },
        "runoff_l": { "$ref": "#/$defs/surface" },
        "runoff_r": { "$ref": "#/$defs/surface" },
        "runoff_l_m": { "type": "number", "minimum": 0, "maximum": 200 },
        "runoff_r_m": { "type": "number", "minimum": 0, "maximum": 200 },
        "apron_l_m": { "description": "A paved apron past the road's left edge (and its curb), m across it (D202).", "type": "number", "minimum": 0, "maximum": 30 },
        "apron_r_m": { "type": "number", "minimum": 0, "maximum": 30 },
        "apron_l_deg": { "description": "The apron's slope, degrees; + raises the left side, as bank_deg.", "type": "number", "minimum": -30, "maximum": 30 },
        "apron_r_deg": { "type": "number", "minimum": -30, "maximum": 30 },
        "barrier_l": { "$ref": "#/$defs/barrier" },
        "barrier_r": { "$ref": "#/$defs/barrier" }
      }
    }
  }
}
