{
  "schema": "noss.track/1",
  "id": "kart_small",
  "name": "Kart Small (test)",
  "type": "circuit",
  "style": "retro_ps2",
  "road": {
    "mode": "road",
    "defaults": {
      "width_l": 6.0,
      "width_r": 6.0,
      "bank_deg": 0.0,
      "height": "ground",
      "lanes": 1,
      "lines": "edges",
      "surface": "asphalt",
      "curb_l": "auto",
      "curb_r": "auto",
      "runoff_l": "grass",
      "runoff_r": "grass",
      "runoff_l_m": 16.0,
      "runoff_r_m": 16.0,
      "barrier_l": "auto",
      "barrier_r": "auto"
    },
    "points": [
      {
        "p": [
          0.0,
          0.0,
          -100.0
        ]
      },
      {
        "p": [
          55.0,
          0.0,
          -100.0
        ]
      },
      {
        "p": [
          110.0,
          0.0,
          -100.0
        ]
      },
      {
        "p": [
          165.0,
          0.0,
          -100.0
        ]
      },
      {
        "p": [
          179.240005493164,
          0.0,
          -98.129997253418
        ]
      },
      {
        "p": [
          192.5,
          0.0,
          -92.629997253418
        ]
      },
      {
        "p": [
          203.889999389648,
          0.0,
          -83.8899993896484
        ]
      },
      {
        "p": [
          212.630004882812,
          0.0,
          -72.5
        ]
      },
      {
        "p": [
          218.130004882812,
          0.0,
          -59.2400016784668
        ]
      },
      {
        "p": [
          220.0,
          0.0,
          -45.0
        ]
      },
      {
        "p": [
          220.0,
          0.0,
          0.0
        ]
      },
      {
        "p": [
          220.0,
          0.0,
          45.0
        ]
      },
      {
        "p": [
          218.130004882812,
          0.0,
          59.2400016784668
        ]
      },
      {
        "p": [
          212.630004882812,
          0.0,
          72.5
        ]
      },
      {
        "p": [
          203.889999389648,
          0.0,
          83.8899993896484
        ]
      },
      {
        "p": [
          192.5,
          0.0,
          92.629997253418
        ]
      },
      {
        "p": [
          179.240005493164,
          0.0,
          98.129997253418
        ]
      },
      {
        "p": [
          165.0,
          0.0,
          100.0
        ]
      },
      {
        "p": [
          110.0,
          0.0,
          100.0
        ]
      },
      {
        "p": [
          55.0,
          0.0,
          100.0
        ]
      },
      {
        "p": [
          0.0,
          0.0,
          100.0
        ]
      },
      {
        "p": [
          -55.0,
          0.0,
          100.0
        ]
      },
      {
        "p": [
          -110.0,
          0.0,
          100.0
        ]
      },
      {
        "p": [
          -165.0,
          0.0,
          100.0
        ]
      },
      {
        "p": [
          -179.240005493164,
          0.0,
          98.129997253418
        ]
      },
      {
        "p": [
          -192.5,
          0.0,
          92.629997253418
        ]
      },
      {
        "p": [
          -203.889999389648,
          0.0,
          83.8899993896484
        ]
      },
      {
        "p": [
          -212.630004882812,
          0.0,
          72.5
        ]
      },
      {
        "p": [
          -218.130004882812,
          0.0,
          59.2400016784668
        ]
      },
      {
        "p": [
          -220.0,
          0.0,
          45.0
        ]
      },
      {
        "p": [
          -220.0,
          0.0,
          0.0
        ]
      },
      {
        "p": [
          -220.0,
          0.0,
          -45.0
        ]
      },
      {
        "p": [
          -218.130004882812,
          0.0,
          -59.2400016784668
        ]
      },
      {
        "p": [
          -212.630004882812,
          0.0,
          -72.5
        ]
      },
      {
        "p": [
          -203.889999389648,
          0.0,
          -83.8899993896484
        ]
      },
      {
        "p": [
          -192.5,
          0.0,
          -92.629997253418
        ]
      },
      {
        "p": [
          -179.240005493164,
          0.0,
          -98.129997253418
        ]
      },
      {
        "p": [
          -165.0,
          0.0,
          -100.0
        ]
      },
      {
        "p": [
          -110.0,
          0.0,
          -100.0
        ]
      },
      {
        "p": [
          -55.0,
          0.0,
          -100.0
        ]
      }
    ]
  },
  "race": {
    "start_m": 60.0,
    "sectors_m": [],
    "checkpoint_spacing_m": 100.0,
    "grid": {
      "slots": 12,
      "front_m": 12.0,
      "row_m": 13.0,
      "stagger": 0.5,
      "pole": "left"
    },
    "rolling_back_m": 220.0,
    "gantry": true,
    "ai": {
      "caution_until_m": -1.0,
      "pins": []
    }
  },
  "ground": {
    "flat_y": -0.03,
    "surface": "grass"
  },
  "props": {
    "items": [],
    "scatter": []
  },
  "environment": {},
  "scene": null,
  "kart": {
    "boxes": "auto",
    "stunts": [
      {
        "id": "pad_1",
        "kind": "boost_pad",
        "at_m": 80.0,
        "lateral_m": 0.0
      },
      {
        "id": "row_1",
        "kind": "item_row",
        "at_m": 100.0
      },
      {
        "id": "jump_1",
        "kind": "jump",
        "at_m": 122.9,
        "height_m": 1.2,
        "length_m": 8.0
      },
      {
        "id": "wall_1",
        "kind": "wall_ride",
        "at_m": 168.1,
        "length_m": 90.0,
        "side": "right",
        "height_m": 5.0
      },
      {
        "id": "loop_1",
        "kind": "loop",
        "at_m": 592.8,
        "radius_m": 9.0,
        "width_m": 5.0
      },
      {
        "id": "row_2",
        "kind": "item_row",
        "at_m": 889.1
      }
    ]
  }
}
