{
  "schema": "noss.track/1",
  "id": "arena_small",
  "name": "Arena Small (test)",
  "type": "arena",
  "style": "retro_ps2",
  "road": {
    "mode": "road",
    "defaults": {
      "width_l": 6.0,
      "width_r": 6.0,
      "bank_deg": 0.0,
      "height": "ground",
      "lanes": 1,
      "lines": "edges",
      "surface": "asphalt",
      "curb_l": "auto",
      "curb_r": "auto",
      "runoff_l": "grass",
      "runoff_r": "grass",
      "runoff_l_m": 16.0,
      "runoff_r_m": 16.0,
      "barrier_l": "auto",
      "barrier_r": "auto"
    },
    "points": [
      {
        "p": [
          0.0,
          0.0,
          -40.0
        ]
      },
      {
        "p": [
          19.0,
          0.0,
          -40.0
        ]
      },
      {
        "p": [
          38.0,
          0.0,
          -40.0
        ]
      },
      {
        "p": [
          44.0,
          0.0,
          -38.3899993896484
        ]
      },
      {
        "p": [
          48.3899993896484,
          0.0,
          -34.0
        ]
      },
      {
        "p": [
          50.0,
          0.0,
          -28.0
        ]
      },
      {
        "p": [
          50.0,
          0.0,
          0.0
        ]
      },
      {
        "p": [
          50.0,
          0.0,
          28.0
        ]
      },
      {
        "p": [
          48.3899993896484,
          0.0,
          34.0
        ]
      },
      {
        "p": [
          44.0,
          0.0,
          38.3899993896484
        ]
      },
      {
        "p": [
          38.0,
          0.0,
          40.0
        ]
      },
      {
        "p": [
          12.6700000762939,
          0.0,
          40.0
        ]
      },
      {
        "p": [
          -12.6700000762939,
          0.0,
          40.0
        ]
      },
      {
        "p": [
          -38.0,
          0.0,
          40.0
        ]
      },
      {
        "p": [
          -44.0,
          0.0,
          38.3899993896484
        ]
      },
      {
        "p": [
          -48.3899993896484,
          0.0,
          34.0
        ]
      },
      {
        "p": [
          -50.0,
          0.0,
          28.0
        ]
      },
      {
        "p": [
          -50.0,
          0.0,
          0.0
        ]
      },
      {
        "p": [
          -50.0,
          0.0,
          -28.0
        ]
      },
      {
        "p": [
          -48.3899993896484,
          0.0,
          -34.0
        ]
      },
      {
        "p": [
          -44.0,
          0.0,
          -38.3899993896484
        ]
      },
      {
        "p": [
          -38.0,
          0.0,
          -40.0
        ]
      },
      {
        "p": [
          -19.0,
          0.0,
          -40.0
        ]
      }
    ]
  },
  "race": {
    "start_m": 0.0,
    "sectors_m": [],
    "checkpoint_spacing_m": 100.0,
    "grid": {
      "slots": 20,
      "front_m": 12.0,
      "row_m": 13.0,
      "stagger": 0.5,
      "pole": "left"
    },
    "rolling_back_m": 220.0,
    "gantry": false,
    "ai": {
      "caution_until_m": -1.0,
      "pins": []
    }
  },
  "ground": {
    "flat_y": -0.03,
    "surface": "grass"
  },
  "props": {
    "items": [],
    "scatter": []
  },
  "environment": {},
  "scene": null,
  "arena": {
    "floor": "asphalt",
    "wall": "tyres"
  },
  "kart": {
    "stunts": [
      {
        "id": "pad_1",
        "kind": "boost_pad",
        "p": [
          0.0,
          0.0,
          -20.0
        ],
        "yaw_deg": 90.0
      },
      {
        "id": "jump_1",
        "kind": "jump",
        "p": [
          22.0,
          0.0,
          6.0
        ],
        "yaw_deg": 0.0,
        "height_m": 1.0,
        "length_m": 7.0,
        "width_m": 5.0
      }
    ]
  }
}
