{
  "arena": {
    "boxes": [
      {
        "count": 4,
        "p": [
          19.8,
          0.0,
          19.8
        ]
      },
      {
        "count": 4,
        "p": [
          -19.8,
          0.0,
          19.8
        ]
      },
      {
        "count": 4,
        "p": [
          -19.8,
          0.0,
          -19.8
        ]
      },
      {
        "count": 4,
        "p": [
          19.8,
          0.0,
          -19.8
        ]
      },
      {
        "count": 4,
        "p": [
          0.0,
          0.0,
          -45.0
        ]
      }
    ],
    "floor": "dirt",
    "wall": "tyres"
  },
  "environment": {},
  "ground": {
    "flat_y": -0.03,
    "surface": "grass"
  },
  "id": "dust_bowl",
  "kart": {
    "boxes": "auto",
    "stunts": [
      {
        "height_m": 1.2,
        "id": "jump_1",
        "kind": "jump",
        "length_m": 8.0,
        "p": [
          11.0,
          0.0,
          0.0
        ],
        "width_m": 6.0,
        "yaw_deg": -90.0
      },
      {
        "height_m": 1.2,
        "id": "jump_2",
        "kind": "jump",
        "length_m": 8.0,
        "p": [
          0.0,
          0.0,
          11.0
        ],
        "width_m": 6.0,
        "yaw_deg": -180.0
      },
      {
        "height_m": 1.2,
        "id": "jump_3",
        "kind": "jump",
        "length_m": 8.0,
        "p": [
          -11.0,
          0.0,
          0.0
        ],
        "width_m": 6.0,
        "yaw_deg": 90.0
      },
      {
        "height_m": 1.2,
        "id": "jump_4",
        "kind": "jump",
        "length_m": 8.0,
        "p": [
          0.0,
          0.0,
          -11.0
        ],
        "width_m": 6.0,
        "yaw_deg": 0.0
      }
    ]
  },
  "name": "Dust Bowl",
  "props": {
    "items": [],
    "scatter": []
  },
  "race": {
    "ai": {
      "caution_until_m": -1.0,
      "pins": []
    },
    "checkpoint_spacing_m": 100.0,
    "gantry": false,
    "grid": {
      "front_m": 12.0,
      "pole": "left",
      "row_m": 13.0,
      "slots": 20,
      "stagger": 0.5
    },
    "rolling_back_m": 220.0,
    "sectors_m": [],
    "start_m": 0.0
  },
  "road": {
    "defaults": {
      "bank_deg": 0.0,
      "barrier_l": "auto",
      "barrier_r": "auto",
      "curb_l": "auto",
      "curb_r": "auto",
      "height": "ground",
      "lanes": 1,
      "lines": "edges",
      "runoff_l": "grass",
      "runoff_l_m": 16.0,
      "runoff_r": "grass",
      "runoff_r_m": 16.0,
      "surface": "asphalt",
      "width_l": 6.0,
      "width_r": 6.0
    },
    "mode": "road",
    "points": [
      {
        "p": [
          60.0,
          0.0,
          0.0
        ]
      },
      {
        "p": [
          57.96,
          0.0,
          15.53
        ]
      },
      {
        "p": [
          51.96,
          0.0,
          30.0
        ]
      },
      {
        "p": [
          42.43,
          0.0,
          42.43
        ]
      },
      {
        "p": [
          30.0,
          0.0,
          51.96
        ]
      },
      {
        "p": [
          15.53,
          0.0,
          57.96
        ]
      },
      {
        "p": [
          0.0,
          0.0,
          60.0
        ]
      },
      {
        "p": [
          -15.53,
          0.0,
          57.96
        ]
      },
      {
        "p": [
          -30.0,
          0.0,
          51.96
        ]
      },
      {
        "p": [
          -42.43,
          0.0,
          42.43
        ]
      },
      {
        "p": [
          -51.96,
          0.0,
          30.0
        ]
      },
      {
        "p": [
          -57.96,
          0.0,
          15.53
        ]
      },
      {
        "p": [
          -60.0,
          0.0,
          0.0
        ]
      },
      {
        "p": [
          -57.96,
          0.0,
          -15.53
        ]
      },
      {
        "p": [
          -51.96,
          0.0,
          -30.0
        ]
      },
      {
        "p": [
          -42.43,
          0.0,
          -42.43
        ]
      },
      {
        "p": [
          -30.0,
          0.0,
          -51.96
        ]
      },
      {
        "p": [
          -15.53,
          0.0,
          -57.96
        ]
      },
      {
        "p": [
          0.0,
          0.0,
          -60.0
        ]
      },
      {
        "p": [
          15.53,
          0.0,
          -57.96
        ]
      },
      {
        "p": [
          30.0,
          0.0,
          -51.96
        ]
      },
      {
        "p": [
          42.43,
          0.0,
          -42.43
        ]
      },
      {
        "p": [
          51.96,
          0.0,
          -30.0
        ]
      },
      {
        "p": [
          57.96,
          0.0,
          -15.53
        ]
      }
    ]
  },
  "scene": null,
  "schema": "noss.track/1",
  "style": "retro_ps2",
  "type": "arena"
}
